id,title,description,type,release_year,genres,production_countries,Netflix Link,TMDb Trailer,runtime,imdb_score,imdb_votes,tmdb_popularity,tmdb_score,type_netflix
tm370212,Adrift,"A true story of survival, as a young couple's chance encounter leads them first to love, and then on the adventure of a lifetime as they face one of the most catastrophic hurricanes in recorded history.",MOVIE,2018,"thriller, drama, romance, action, european","HK, IS, US",https://www.netflix.com/watch/80240550,https://www.youtube.com/watch?v=n9ukI7khQpE,96,6.6,54750.0,17.991,6.9,0
ts58152,Cathedral of the Sea,"In the 14th century, Barcelona is experiencing one of its most prosperous moments. The city has grown to La Ribera, a fishing district in which the largest Marian temple ever known is built: Santa María del Mar. But the construction runs parallel to Arnau Estanyol, a serf of the land who, fleeing the abuses of The feudal lords of the countryside take refuge in Barcelona.",SHOW,2018,"drama, history",ES,https://www.netflix.com/watch/80150507,https://www.youtube.com/watch?v=80WflPMzAcw,57,7.4,4292.0,13.03,7.1,1
ts84779,Haunted,"Real people sit down with friends and family to share terrifying true stories from their past, re-created through chilling re-enactments.",SHOW,2018,"documentation, horror, reality",US,https://www.netflix.com/watch/80195378,https://www.youtube.com/watch?v=1g8a96rw-Jc,25,4.6,3150.0,19.435,7.0,1
tm410742,Happy as Lazzaro,"Purehearted teen Lazzaro is content living as a sharecropper in rural Italy, but an unlikely friendship with the marquise’s son will change his world.",MOVIE,2018,"fantasy, drama, european","IT, CH, FR",https://www.netflix.com/watch/81004245,https://www.youtube.com/watch?v=e3gS7BDmZlw,125,7.5,17716.0,8.295,7.4,0
tm281935,A Bad Moms Christmas,"Amy, Kiki and Carla – three under-appreciated and over-burdened women – rebel against the challenges and expectations of the Super Bowl for mothers: Christmas. And if creating a more perfect holiday for their families wasn’t hard enough, they have to do all of that while hosting and entertaining their own mothers.",MOVIE,2017,comedy,US,https://www.netflix.com/watch/80177872,https://www.youtube.com/watch?v=geby7Ene7dY,104,5.6,49478.0,20.005,6.3,0
tm139885,The Other Side of the Wind,"Surrounded by fans and skeptics, grizzled director J.J. ""Jake"" Hannaford returns from years abroad in Europe to a changed Hollywood, where he attempts to make his innovative comeback film.  This film was started in 1970 but never completed during Welles lifetime.",MOVIE,2018,"drama, european","US, FR, IR",https://www.netflix.com/watch/80085566,https://www.youtube.com/watch?v=nMWHBUTHmf0,122,6.7,7104.0,7.453,6.7,0
ts56038,Dave Chappelle,"Comedy icon Dave Chappelle makes his triumphant return to the screen with a pair of blistering, fresh stand-up specials.",SHOW,2017,"comedy, documentation",US,https://www.netflix.com/watch/80171965,https://www.youtube.com/watch?v=OaRBPXLgKyg,60,8.7,2753.0,4.516,7.6,1
ts84574,Salt Fat Acid Heat,"Chef and food writer Samin Nosrat travels the world to explore four basic keys to wonderful cooking, serving up feasts and helpful tips along the way.",SHOW,2018,documentation,US,https://www.netflix.com/watch/80198288,https://www.youtube.com/watch?v=2oKbs4jAf7M,40,7.7,2419.0,4.037,8.3,1
ts56481,Great News,A New Jersey mom puts her relationship with her daughter to the test when she lands an internship at the same TV station where her daughter works.,SHOW,2017,comedy,US,https://www.netflix.com/watch/80158516,https://www.youtube.com/watch?v=eIhUsfhXBJM,21,7.0,6810.0,8.665,6.5,1
ts55231,Abstract: The Art of Design,Step inside the minds of the most innovative designers in a variety of disciplines and learn how design impacts every aspect of life.,SHOW,2017,documentation,US,https://www.netflix.com/watch/80057883,https://www.youtube.com/watch?v=DYaq2sWTWAA,45,8.4,5306.0,12.42,8.0,1
ts57814,Kakegurui,"Hyakkaou Private Academy. An institution for the privileged with a very peculiar curriculum. You see, when you're the sons and daughters of the wealthiest of the wealthy, it's not athletic prowess or book smarts that keep you ahead. It's reading your opponent, the art of the deal. What better way to hone those skills than with a rigorous curriculum of gambling? At Hyakkaou Private Academy, the winners live like kings, and the losers are put through the wringer. But when Yumeko Jabami enrolls, she's gonna teach these kids what a high roller really looks like!",SHOW,2017,"action, animation, drama, thriller",JP,https://www.netflix.com/watch/80233218,https://www.youtube.com/watch?v=cTlHQiRNVl0,24,7.2,8547.0,54.832,8.3,1
ts57814,Kakegurui,"Hyakkaou Private Academy. An institution for the privileged with a very peculiar curriculum. You see, when you're the sons and daughters of the wealthiest of the wealthy, it's not athletic prowess or book smarts that keep you ahead. It's reading your opponent, the art of the deal. What better way to hone those skills than with a rigorous curriculum of gambling? At Hyakkaou Private Academy, the winners live like kings, and the losers are put through the wringer. But when Yumeko Jabami enrolls, she's gonna teach these kids what a high roller really looks like!",SHOW,2017,"action, animation, drama, thriller",JP,https://www.netflix.com/watch/80175351,https://www.youtube.com/watch?v=cTlHQiRNVl0,24,7.2,8547.0,54.832,8.3,1
ts113109,Numberblocks,"Learning numbers and how to count with colourful personified blocks, each with their own quirks.",SHOW,2017,animation,GB,https://www.netflix.com/watch/81272431,https://www.youtube.com/watch?v=ALjPHmn81aE,5,8.6,198.0,10.667,9.5,1
ts85138,Dogs,"These six intimate stories explore the abiding emotional bonds that form between dogs and their caregivers, no matter the circumstances.",SHOW,2018,documentation,US,https://www.netflix.com/watch/80191036,https://www.youtube.com/watch?v=5pLCmLgjiJ8,50,8.0,1269.0,3.54,8.3,1
ts57424,The Forest,"In a small quiet village in the Ardennes, a sixteen-year-old girl disappears into the forest after calling her teacher in the middle of the night. Captain Gaspard Deker, a former soldier and newly arrived single father is conducting the investigation with Virginie Musso, the local cop. Also helping is the teacher, Eve Mendel, a solitary young woman with a mysterious past: she was found as a child by the villiage doctor wandering silently in the same forest.",SHOW,2017,"crime, thriller, drama, european",FR,https://www.netflix.com/watch/80240691,https://www.youtube.com/watch?v=6hW8hUcXR-A,52,7.2,10137.0,18.051,7.1,1
ts57424,The Forest,"In a small quiet village in the Ardennes, a sixteen-year-old girl disappears into the forest after calling her teacher in the middle of the night. Captain Gaspard Deker, a former soldier and newly arrived single father is conducting the investigation with Virginie Musso, the local cop. Also helping is the teacher, Eve Mendel, a solitary young woman with a mysterious past: she was found as a child by the villiage doctor wandering silently in the same forest.",SHOW,2017,"crime, thriller, drama, european",FR,https://www.netflix.com/watch/80049282,https://www.youtube.com/watch?v=lBgKi0XVn4A,52,7.2,10137.0,18.051,7.1,1
tm217228,Death Note,"A young man comes to possess a supernatural notebook, the Death Note, that grants him the power to kill any person simply by writing down their name on the pages. He then decides to use the notebook to kill criminals and change the world, but an enigmatic detective attempts to track him down and end his reign of terror.",MOVIE,2017,"fantasy, horror, thriller, action, crime, drama",US,https://www.netflix.com/watch/70068528,https://www.youtube.com/watch?v=gvxNaSIB_WI,101,4.5,83519.0,22.306,4.2,0
tm217228,Death Note,"A young man comes to possess a supernatural notebook, the Death Note, that grants him the power to kill any person simply by writing down their name on the pages. He then decides to use the notebook to kill criminals and change the world, but an enigmatic detective attempts to track him down and end his reign of terror.",MOVIE,2017,"fantasy, horror, thriller, action, crime, drama",US,https://www.netflix.com/watch/80122759,https://www.youtube.com/watch?v=gvxNaSIB_WI,101,4.5,83519.0,22.306,4.2,0
tm217228,Death Note,"A young man comes to possess a supernatural notebook, the Death Note, that grants him the power to kill any person simply by writing down their name on the pages. He then decides to use the notebook to kill criminals and change the world, but an enigmatic detective attempts to track him down and end his reign of terror.",MOVIE,2017,"fantasy, horror, thriller, action, crime, drama",US,https://www.netflix.com/watch/70204970,https://www.youtube.com/watch?v=WsiWrr8uZGo,101,4.5,83519.0,22.306,4.2,0
ts77474,Mr. Sunshine,"Set in the early 1900s, this drama tells the story of a young man from Korea who grows up in the United States. When he returns to Korea as a US Marine Corps officer, he meets and falls in love with a noblewoman who is fighting for Korean independence. Their romance is complicated by social class and political ideology.",SHOW,2018,"drama, action, history, romance, war",KR,https://www.netflix.com/watch/80991107,https://www.youtube.com/watch?v=rPJSo4fhtRU,76,8.7,6855.0,16.097,8.516,1
tm244307,Bright,"In an alternate present-day where magical creatures live among us, two L.A. cops become embroiled in a prophesied turf battle.",MOVIE,2017,"thriller, fantasy, action, crime, scifi",US,https://www.netflix.com/watch/80119234,https://www.youtube.com/watch?v=6EZCBSsBxko,117,6.3,183841.0,36.593,6.2,0
tm298846,The Incredible Jessica James,"Burned by a bad breakup, a struggling New York City playwright makes an unlikely connection with a divorced app designer she meets on a blind date.",MOVIE,2017,comedy,US,https://www.netflix.com/watch/80171022,https://www.youtube.com/watch?v=zEkYAzSpHnA,83,6.5,7496.0,9.638,6.2,0
tm412623,The Kissing Booth,"When teenager Elle's first kiss leads to a forbidden romance with the hottest boy in high school, she risks her relationship with her best friend.",MOVIE,2018,"romance, comedy",GB,https://www.netflix.com/watch/80143556,https://www.youtube.com/watch?v=7bfS6seiLhk,105,5.9,81639.0,77.096,7.3,0
tm298339,Handsome Devil,A music-mad 16-year-old outcast at a rugby-mad boarding school forms an unlikely friendship with his dashing new roommate.,MOVIE,2017,"drama, comedy, sport, european",IE,https://www.netflix.com/watch/80151962,https://www.youtube.com/watch?v=O8DbQTjzMKs,95,7.0,13708.0,12.021,7.1,0
tm245176,Sand Castle,"Set during the occupation of Iraq, a squad of U.S. soldiers try to protect a small village.",MOVIE,2017,"drama, action, war","IQ, GB",https://www.netflix.com/watch/80118916,https://www.youtube.com/watch?v=8hq28cZ938E,113,6.3,22854.0,27.077,6.5,0
ts78298,My Mister,"In a world that is less than kind, a young woman and a middle-aged man develop a sense of kinship as they find warmth and comfort in one another.",SHOW,2018,"drama, family",KR,https://www.netflix.com/watch/81267691,https://www.youtube.com/watch?v=yGOkLD_dTLo,79,9.2,5481.0,13.025,8.9,1
ts83251,Magic for Humans,"From baffling people on the street to orchestrating elaborate tricks, Justin Willman blends good-natured magic with grown-up laughs.",SHOW,2018,"comedy, reality",US,https://www.netflix.com/watch/80190510,https://www.youtube.com/watch?v=pvFqi-YFWe8,24,7.1,3316.0,6.964,6.7,1
tm321224,"Game Over, Man!",Three friends are on the verge of getting their video game financed when their benefactor is taken hostage by terrorists.,MOVIE,2018,"comedy, action",US,https://www.netflix.com/watch/80169617,https://www.youtube.com/watch?v=u7ZHi_dDSnQ,100,5.4,29773.0,14.358,5.5,0
tm359978,Forgotten,"Seoul, South Korea, 1997. When the young but extremely anxious student Jin-seok, his parents and his successful older brother Yoo-seok move to a new home, mysterious and frightening events begin to happen around them, unexplained events that threaten to ruin their seemingly happy lives. Unable to understand what is happening, Jin-seok wonders if he is losing his mind.",MOVIE,2017,"thriller, horror, crime, scifi",KR,https://www.netflix.com/watch/80223050,https://vimeo.com/254449964,109,7.4,29804.0,33.53,8.0,0
tm306301,Piercing,"After kissing his wife and baby goodbye for a seemingly normal business trip, Reed checks himself into a hotel room to accomplish something he’s always dreamed of: the perfect murder. As his sinister plans unfold, he soon realizes he might be in over his head with a mysteriously unhinged call girl named Jackie.",MOVIE,2018,"thriller, horror","FR, US",https://www.netflix.com/watch/81003068,https://www.youtube.com/watch?v=cPqMhO165fg,82,5.5,7534.0,8.611,5.8,0
ts57947,Unit 42,"The investigations of two police officers from The Brussels Digital Unit, a unit specializing in cybercrime.",SHOW,2017,"crime, thriller, drama, european",BE,https://www.netflix.com/watch/81027195,https://www.youtube.com/watch?v=pSyJ8cl0ZLQ,48,7.0,2311.0,9.078,6.6,1
ts53936,Innocent,"In a peaceful, rustic town, a retired officer and his family are mired in a murder mystery riddled with shocking, buried secrets.",SHOW,2017,"drama, crime",TR,https://www.netflix.com/watch/81026192,https://www.youtube.com/watch?v=dRnbL_nMjJs,51,8.4,17727.0,7.297,8.1,1
ts83763,Black Earth Rising,"As a child, Kate Ashby was rescued from the horrific aftermath of the Rwandan genocide and brought to the UK. But the tragic shadow of her past proves impossible to escape.",SHOW,2018,"crime, thriller",GB,https://www.netflix.com/watch/80145141,https://www.youtube.com/watch?v=ugxQuVPmVZU,59,7.4,4790.0,5.831,7.1,1
tm298084,On Body and Soul,"Two introverted people find out by pure chance that they share the same dream every night. They are puzzled, incredulous, a bit frightened. As they hesitantly accept this strange coincidence, they try to recreate in broad daylight what happens in their dream.",MOVIE,2017,"fantasy, drama, romance",HU,https://www.netflix.com/watch/80177414,https://www.youtube.com/watch?v=jK5tIkuTKbA,116,7.5,27003.0,7.285,7.2,0
tm244148,Mowgli: Legend of the Jungle,"A human child raised by wolves, must face off against a menacing tiger named Shere Khan, as well as his own origins.",MOVIE,2018,"drama, fantasy","GB, US",https://www.netflix.com/watch/80993105,https://www.youtube.com/watch?v=OVBjPpUlQrE,105,6.5,60870.0,24.646,6.5,0
tm219259,Goon: Last of the Enforcers,"During a pro lockout, Doug ""The Thug"" Glatt is injured and must choose whether to defend his team against a dangerous new enemy, or be there for his wife as she prepares to give birth to his daughter.",MOVIE,2017,"comedy, sport",CA,https://www.netflix.com/watch/80163263,https://www.youtube.com/watch?v=eAdDciuOYqI,101,5.8,13476.0,13.329,5.7,0
ts80523,Aggretsuko,"Frustrated with her thankless office job, Retsuko the Red Panda copes with her daily struggles by belting out death metal karaoke after work.",SHOW,2018,"animation, music, romance, comedy, drama",JP,https://www.netflix.com/watch/80198505,https://www.youtube.com/watch?v=lgPgktxjlaU,16,8.0,6005.0,13.244,7.2,1
ts83561,Immortals,"Driven by revenge, human-turned-vampire Mia sets out to vanquish Dmitry, a ruthless vampire leader who seeks an artifact that grants immortality.",SHOW,2018,"scifi, action, drama, fantasy, thriller, music",TR,https://www.netflix.com/watch/70153860,https://www.youtube.com/watch?v=pE3yR8bZ1pY,28,5.4,3087.0,13.712,6.5,1
tm375912,Ricky Gervais: Humanity,"In his first special in seven years, Ricky Gervais slings his trademark snark at celebrity, mortality and a society that takes everything personally.",MOVIE,2018,comedy,GB,https://www.netflix.com/watch/80189653,https://www.youtube.com/watch?v=XAwU3Lyn--U,79,7.9,18523.0,8.01,7.7,0
tm244317,To the Bone,A young woman dealing with anorexia meets an unconventional doctor who challenges her to face her condition and embrace life.,MOVIE,2017,drama,US,https://www.netflix.com/watch/80171659,https://www.youtube.com/watch?v=705yRfs6Dbs,107,6.8,47025.0,22.167,7.2,0
ts78382,On My Block,A coming of age comedy following a diverse group of teenage friends as they confront the challenges of growing up in gritty inner-city Los Angeles.,SHOW,2018,"comedy, drama",US,https://www.netflix.com/watch/80117809,https://www.youtube.com/watch?v=us_AXwJKjjY,29,7.9,15642.0,31.784,8.5,1
ts41527,Gypsy,The journey of Jean Holloway – a therapist who begins to develop dangerous and intimate relationships with the people in her patients' lives.,SHOW,2017,"drama, thriller",US,https://www.netflix.com/watch/80095411,https://www.youtube.com/watch?v=6EGKOEuUBws,59,6.8,16133.0,13.857,6.4,1
tm292837,The Bar,"In downtown Madrid, a series of mysterious gunshots trap a motley assortment of people in a decrepit bar.",MOVIE,2017,"horror, thriller, comedy, fantasy, european",ES,https://www.netflix.com/watch/80103311,https://www.youtube.com/watch?v=wcOqUb5Z7xg,102,6.3,25934.0,11.671,6.3,0
tm414709,Siberia,"Lucas, a diamond trader who travels to Saint Petersburg to arrange a sale, discovers that his Russian business partner has left his hotel and gone to a small Siberian village, so Lucas also heads there to try find him.",MOVIE,2018,"thriller, european, crime, romance","DE, CA, US",https://www.netflix.com/watch/81003774,https://www.youtube.com/watch?v=FrXPIZN2ehY,105,4.3,15038.0,22.0,4.8,0
tm233294,War Machine,A rock star general bent on winning the “impossible” war in Afghanistan takes us inside the complex machinery of modern war. Inspired by the true story of General Stanley McChrystal.,MOVIE,2017,"drama, comedy, war",US,https://www.netflix.com/watch/80068327,https://www.youtube.com/watch?v=a9Jg20Ukf4E,122,6.0,45972.0,12.235,5.552,0
tm324155,Security,"An ex-special services veteran, down on his luck and desperate for work, takes a job as a security guard at a run-down mall in a rough area of town. On his first night on the job, he opens the door to a distraught and desperate young girl who has fled the hijacking of a Police motorcade that was transporting her to testify as a witness in a trial. Hot on her heels is the psychopathic hijacker and his team of henchmen, who will stop at nothing to extract and eliminate the witness.",MOVIE,2017,"crime, thriller, action, european",US,https://www.netflix.com/watch/80161921,https://www.youtube.com/watch?v=zbOqeh8VYCI,87,5.7,18618.0,31.419,6.2,0
tm289181,Newness,"In contemporary Los Angeles, two millennials navigating a social media–driven hookup culture begin a relationship that pushes both emotional and physical boundaries.",MOVIE,2017,"drama, romance",US,https://www.netflix.com/watch/80172958,https://www.youtube.com/watch?v=EtBhKTuPjEk,112,6.3,16459.0,34.214,6.1,0
ts89538,Bitter Daisies,"While investigating the disappearance of a teen girl in a tight-knit Galician town, a Civil Guard officer uncovers secrets linked to a loss of her own.",SHOW,2018,"drama, thriller",ES,https://www.netflix.com/watch/80992232,https://www.youtube.com/watch?v=5cDK_W7dP78,71,7.2,3274.0,11.931,7.1,1
tm370436,The Breaker Upperers,Two women run a business breaking up couples for cash but when one develops a conscience their friendship unravels.,MOVIE,2018,comedy,NZ,https://www.netflix.com/watch/80992672,https://www.youtube.com/watch?v=qKVhDbe9VOo,82,5.9,6008.0,7.605,5.2,0
tm351216,Joan Didion: The Center Will Not Hold,"Griffin Dunne’s years-in-the-making documentary portrait of his aunt Joan Didion moves with the spirit of her uncannily lucid writing: the film simultaneously expands and zeroes in, covering a vast stretch of turbulent cultural history with elegance and candor.",MOVIE,2017,documentation,US,https://www.netflix.com/watch/80117454,https://www.youtube.com/watch?v=99NaRJQzXiM,92,7.4,2596.0,5.069,7.1,0
tm318200,Clive Davis: The Soundtrack of Our Lives,"The life and successes of iconic music executive Clive Davis, from his miraculous start at Columbia Records through his trailblazing work at Arista Records and J Records, with a heavy dose of outstanding music sprinkled in between.",MOVIE,2017,"music, documentation",US,https://www.netflix.com/watch/80190588,https://www.youtube.com/watch?v=RaYqX-0AwRw,123,7.5,950.0,4.315,6.3,0
ts57464,Life Sentence,"When Stella finds out her terminal cancer is cured, she's going to have to learn to live with all the choices she's made when she decided to ""live like she was dying"".",SHOW,2018,"drama, comedy",US,https://www.netflix.com/watch/80179900,https://www.youtube.com/watch?v=4zvoEh6LxO4,42,6.4,3855.0,7.925,6.5,1
ts77525,The Toys That Made Us,The minds behind history's most iconic toy franchises discuss the rise -- and sometimes fall -- of their billion-dollar creations.,SHOW,2017,"documentation, comedy, history",US,https://www.netflix.com/watch/80161497,https://www.youtube.com/watch?v=ssgWySa6uvQ,45,8.0,5545.0,5.924,7.7,1
ts58225,The Standups,"Comedy's freshest voices take the stage in LA for six half-hour specials packed with sly jokes, hilarious anecdotes and awkward confessions.",SHOW,2017,comedy,US,https://www.netflix.com/watch/80175685,https://www.youtube.com/watch?v=b-Vk7KCYjxw,30,6.6,1225.0,2.314,5.8,1
ts84243,Baby,"Fed up with their families and classmates, two teen girls from a wealthy part of Rome are drawn to the city's underworld and start leading double lives.",SHOW,2018,drama,IT,https://www.netflix.com/watch/80211634,https://www.youtube.com/watch?v=-Yu_2nyOP5o,45,6.8,10990.0,38.201,8.0,1
ts56594,Disjointed,Pot activist Ruth Whitefeather Feldman runs a medical marijuana dispensary while encouraging her loyal patients to chill out and enjoy the high life.,SHOW,2017,comedy,US,https://www.netflix.com/watch/80117694,https://www.youtube.com/watch?v=XIVNayzLdTQ,27,6.8,9980.0,14.558,5.8,1
tm370232,We the Animals,"Manny, Joel and Jonah tear their way through childhood and push against the volatile love of their parents. As Manny and Joel grow into versions of their father and Ma dreams of escape, Jonah, the youngest, embraces an imagined world all his own.",MOVIE,2018,drama,US,https://www.netflix.com/watch/80241304,https://www.youtube.com/watch?v=jTRZsrj28C4,94,6.9,4181.0,6.702,6.5,0
tm349800,Unicorn Store,"A woman named Kit moves back to her parent's house, where she receives a mysterious invitation that would fulfill her childhood dreams.",MOVIE,2017,"fantasy, comedy, drama",US,https://www.netflix.com/watch/81034317,https://www.youtube.com/watch?v=r_51UsTDBAE,92,5.5,19140.0,8.72,6.0,0
tm219258,Brain on Fire,"Susannah Cahalan, an up-and-coming journalist at the New York Post becomes plagued by voices in her head and seizures, causing a rapid descent into insanity.",MOVIE,2017,"drama, european","IE, CA",https://www.netflix.com/watch/80128245,https://www.youtube.com/watch?v=e87x_slO544,95,6.6,21164.0,12.009,7.1,0
ts57082,White Gold,"The story of a double-glazing showroom in Essex in the 80s, led by charismatic Vincent Swan, and his unscrupulous sales team, Brian Fitzpatrick and Martin Lavender.",SHOW,2017,"comedy, european",GB,https://www.netflix.com/watch/80191680,https://www.youtube.com/watch?v=1bI4VqfWmZQ,29,7.4,10981.0,5.878,6.9,1
ts53101,Voice,"It's 3 minutes for hearers, but a life for the callers. A crime thriller chasing even the slightest sounds to rescue people's lives calling for urgent help.",SHOW,2017,"crime, thriller, action",KR,https://www.netflix.com/watch/81142595,https://www.youtube.com/watch?v=hFQazVSTQF4,63,7.5,1949.0,17.025,6.9,1
ts53101,Voice,"It's 3 minutes for hearers, but a life for the callers. A crime thriller chasing even the slightest sounds to rescue people's lives calling for urgent help.",SHOW,2017,"crime, thriller, action",KR,https://www.netflix.com/watch/80987095,https://www.youtube.com/watch?v=hFQazVSTQF4,63,7.5,1949.0,17.025,6.9,1
ts81885,The Good Cop,"Honest cop Tony Jr. gets advice from his unscrupulous father, retired NYPD officer Tony Sr., about everything from his job to his love life.",SHOW,2018,"comedy, drama, crime, documentation",US,https://www.netflix.com/watch/80157073,https://www.youtube.com/watch?v=sqZxZ20NrNc,49,6.9,5620.0,8.714,6.4,1
tm406881,Bathtubs Over Broadway,"When he started as a comedy writer for the Late Show with David Letterman, Steve Young had few interests and not many friends outside of his day job. But while gathering material for a segment on the show, Steve stumbled onto a few vintage record albums that would change his life forever.",MOVIE,2018,"comedy, music, documentation",US,https://www.netflix.com/watch/81044103,https://www.youtube.com/watch?v=QTgS1SXr0nc,87,7.6,1065.0,2.742,8.0,0
tm307910,What the Health,"Filmmaker Kip Andersen uncovers the secret to preventing and even reversing chronic diseases, and he investigates why the nation's leading health organizations doesn't want people to know about it.",MOVIE,2017,documentation,US,https://www.netflix.com/watch/80174177,https://www.youtube.com/watch?v=Jf44vLndiRM,97,7.4,28911.0,8.27,7.0,0
ts77799,Rotten,This docuseries travels deep into the heart of the food supply chain to reveal unsavory truths and expose hidden forces that shape what we eat.,SHOW,2018,documentation,US,https://www.netflix.com/watch/80146284,https://www.youtube.com/watch?v=_ot6W_7hvrM,56,7.2,3675.0,6.812,7.4,1
tm368241,Duck Butter,"Dissatisfied with the dishonesty they see in dating, strangers Naima and Sergio make a pact to spend 24 straight hours together in an attempt to fast forward their relationship.",MOVIE,2018,"drama, comedy, romance",US,https://www.netflix.com/watch/80115118,https://www.youtube.com/watch?v=uHOEqF3Mmjs,94,5.3,3909.0,10.766,5.5,0
