id,title,description,type,release_year,genres,production_countries,Netflix Link,TMDb Trailer,runtime,imdb_score,imdb_votes,tmdb_popularity,tmdb_score,type_netflix
ts55762,Kingdom,"In this zombie thriller set in Korea's medieval Joseon dynasty which has been defeated by corruption and famine, a mysterious rumor of the king’s death spreads, as does a strange plague that renders the infected immune to death and hungry for flesh. The crown prince, fallen victim to a conspiracy, sets out on a journey to unveil the evil scheme and save his people.",SHOW,2019,"action, thriller, drama, scifi, horror, history",KR,https://www.netflix.com/watch/80036982,https://www.youtube.com/watch?v=4l-yByZpaaM,48,8.3,43760.0,42.052,8.4,1
ts55762,Kingdom,"In this zombie thriller set in Korea's medieval Joseon dynasty which has been defeated by corruption and famine, a mysterious rumor of the king’s death spreads, as does a strange plague that renders the infected immune to death and hungry for flesh. The crown prince, fallen victim to a conspiracy, sets out on a journey to unveil the evil scheme and save his people.",SHOW,2019,"action, thriller, drama, scifi, horror, history",KR,https://www.netflix.com/watch/80180171,https://www.youtube.com/watch?v=4l-yByZpaaM,48,8.3,43760.0,42.052,8.4,1
ts55762,Kingdom,"In this zombie thriller set in Korea's medieval Joseon dynasty which has been defeated by corruption and famine, a mysterious rumor of the king’s death spreads, as does a strange plague that renders the infected immune to death and hungry for flesh. The crown prince, fallen victim to a conspiracy, sets out on a journey to unveil the evil scheme and save his people.",SHOW,2019,"action, thriller, drama, scifi, horror, history",KR,https://www.netflix.com/watch/80172949,https://www.youtube.com/watch?v=4l-yByZpaaM,48,8.3,43760.0,42.052,8.4,1
tm847085,The Social Dilemma,"This documentary-drama hybrid explores the dangerous human impact of social networking, with tech experts sounding the alarm on their own creations.",MOVIE,2020,"drama, documentation",US,https://www.netflix.com/watch/81254224,https://www.youtube.com/watch?v=uaaC57tcci0,94,7.6,79674.0,20.38,7.5,0
ts89564,Black Summer,"In the dark, early days of a zombie apocalypse, complete strangers band together to find the strength they need to survive and get back to loved ones.",SHOW,2019,"scifi, action, drama, horror, thriller",US,https://www.netflix.com/watch/80198988,https://www.youtube.com/watch?v=tQA1omPJN24,39,6.5,28657.0,30.795,7.1,1
ts84633,The Promised Neverland,"Surrounded by a forest and a gated entrance, the Grace Field House is inhabited by orphans happily living together as one big family, looked after by their ""Mama,"" Isabella. Although they are required to take tests daily, the children are free to spend their time as they see fit, usually playing outside, as long as they do not venture too far from the orphanage — a rule they are expected to follow no matter what. However, all good times must come to an end, as every few months, a child is adopted and sent to live with their new family... never to be heard from again.

However, the three oldest siblings have their suspicions about what is actually happening at the orphanage, and they are about to discover the cruel fate that awaits the children living at Grace Field, including the twisted nature of their beloved Mama.",SHOW,2019,"scifi, action, thriller, drama, fantasy, horror, animation",JP,https://www.netflix.com/watch/81145640,https://www.youtube.com/watch?v=ApLudqucq-s,23,8.4,34730.0,42.367,8.843,1
ts88379,Dracula,"Transylvania, 1897. The blood-drinking Count Dracula is drawing his plans against Victorian London. And be warned: the dead travel fast.",SHOW,2020,"action, drama, fantasy, horror, thriller",GB,https://www.netflix.com/watch/80997687,https://www.youtube.com/watch?v=fokdvaYR220,88,6.8,45971.0,25.177,7.142,1
tm417553,6 Underground,"After faking his death, a tech billionaire recruits a team of international operatives for a bold and bloody mission to take down a brutal dictator.",MOVIE,2019,"action, thriller, comedy",US,https://www.netflix.com/watch/81001887,https://www.youtube.com/watch?v=YLE85olJjp8,127,6.1,168919.0,68.45,6.327,0
tm834851,I Care a Lot,A crooked legal guardian who drains the savings of her elderly wards meets her match when a woman she tries to swindle turns out to be more than she first appears.,MOVIE,2020,"comedy, crime, drama, thriller","US, GB",https://www.netflix.com/watch/81350429,https://www.youtube.com/watch?v=D40uHmTSPew,118,6.3,128172.0,30.192,6.6,0
tm845489,His House,"After making a harrowing escape from war-torn South Sudan, a young refugee couple struggle to adjust to their new life in a small English town that has an unspeakable evil lurking beneath the surface.",MOVIE,2020,"drama, thriller, horror",GB,https://www.netflix.com/watch/81231197,https://www.youtube.com/watch?v=DYY0QJhlXjc,93,6.5,38870.0,27.065,6.5,0
ts57213,The Dark Crystal: Age of Resistance,"Return to the world of Thra, where three Gelfling discover the horrifying secret behind the Skeksis' power and set out to ignite the fires of rebellion and save their world.",SHOW,2019,"scifi, drama, animation, fantasy, family, horror, action","GB, US",https://www.netflix.com/watch/80148535,https://www.youtube.com/watch?v=a3_owZfYVR8,51,8.4,24164.0,23.53,7.8,1
ts82913,When They See Us,Five teens from Harlem become trapped in a nightmare when they're falsely accused of a brutal attack in Central Park.,SHOW,2019,"drama, history, crime",US,https://www.netflix.com/watch/80200549,https://www.youtube.com/watch?v=KyIrJeK2DKY,74,8.9,114127.0,20.965,8.2,1
ts80709,Another Life,"After a massive alien artifact lands on Earth, Niko Breckinridge leads an interstellar mission to track down its source and make first contact.",SHOW,2019,"scifi, thriller, drama",US,https://www.netflix.com/watch/80236236,https://www.youtube.com/watch?v=qAtBbgtMnZ8,42,5.2,35108.0,56.037,6.1,1
ts83082,Living with Yourself,"Burned out on life, Miles undergoes a strange procedure at a strip mall spa -- and wakes to find he's been replaced by a better version of himself.",SHOW,2019,"drama, comedy, scifi",US,https://www.netflix.com/watch/80178724,https://www.youtube.com/watch?v=gm1pIZT09ek,26,7.2,30134.0,9.447,6.8,1
tm824398,The Platform,"A mysterious place, an indescribable prison, a deep hole. An unknown number of levels. Two inmates living on each level. A descending platform containing food for all of them. An inhuman fight for survival, but also an opportunity for solidarity.",MOVIE,2019,"horror, scifi, thriller, european",ES,https://www.netflix.com/watch/81317085,https://www.youtube.com/watch?v=RlfooqeZcdY,94,7.0,207877.0,47.725,7.003,0
tm824398,The Platform,"A mysterious place, an indescribable prison, a deep hole. An unknown number of levels. Two inmates living on each level. A descending platform containing food for all of them. An inhuman fight for survival, but also an opportunity for solidarity.",MOVIE,2019,"horror, scifi, thriller, european",ES,https://www.netflix.com/watch/81128579,https://www.youtube.com/watch?v=Ez0rXJfjnsc,94,7.0,207877.0,47.725,7.003,0
ts218569,The Movies That Made Us,"Unwrap the real stories behind these iconic Christmas blockbusters, thanks to insider interviews and behind-the-scenes peeks.",SHOW,2019,"history, documentation, family",US,https://www.netflix.com/watch/80990849,https://www.youtube.com/watch?v=KmxU31re22k,47,7.6,6147.0,10.08,7.4,1
tm460948,Always Be My Maybe,"Reunited after 15 years, famous chef Sasha and hometown musician Marcus feel the old sparks of attraction but struggle to adapt to each other's worlds.",MOVIE,2019,"romance, comedy",US,https://www.netflix.com/watch/80202874,https://www.youtube.com/watch?v=iHBcWHY9lN4,101,6.8,54166.0,11.434,6.6,0
tm460948,Always Be My Maybe,"Reunited after 15 years, famous chef Sasha and hometown musician Marcus feel the old sparks of attraction but struggle to adapt to each other's worlds.",MOVIE,2019,"romance, comedy",US,https://www.netflix.com/watch/80100170,https://www.youtube.com/watch?v=T8WroCcrbBc,101,6.8,54166.0,11.434,6.6,0
tm911973,Enola Holmes,"While searching for her missing mother, intrepid teen Enola Holmes uses her sleuthing skills to outsmart big brother Sherlock and help a runaway lord.",MOVIE,2020,"crime, drama, action",US,https://www.netflix.com/watch/81277950,https://www.youtube.com/watch?v=1d0Zf9sXlHk,123,6.6,160806.0,22.461,7.3,0
tm362198,Scary Stories to Tell in the Dark,"Mill Valley, Pennsylvania, Halloween night, 1968. After playing a joke on a school bully, Stella and her friends decide to sneak into a supposedly haunted house that once belonged to the powerful Bellows family, unleashing dark forces that they will be unable to control.",MOVIE,2019,"horror, thriller","CA, CN, US",https://www.netflix.com/watch/80244044,https://www.youtube.com/watch?v=Vlya92LZqZw,108,6.2,73859.0,36.326,6.5,0
ts105825,The Valhalla Murders,Police profiler Arnar is sent back home from Oslo to his native Iceland to investigate the country's first serial killer case. He teams up with the local senior cop Kata.,SHOW,2019,"thriller, crime, drama, scifi",IS,https://www.netflix.com/watch/81043833,373985202,46,7.1,13038.0,11.145,6.8,1
tm244207,Triple Frontier,"Struggling to make ends meet, former special ops soldiers reunite for a high-stakes heist: stealing $75 million from a South American drug lord.",MOVIE,2019,"thriller, action, crime, drama",US,https://www.netflix.com/watch/80192187,https://www.youtube.com/watch?v=Fo3yRLLrXQA,125,6.4,124218.0,28.54,6.3,0
tm372066,Fast Color,"A woman is forced to go on the run when her superhuman abilities are discovered. Years after having abandoned her family, the only place she has left to hide is home.",MOVIE,2019,"thriller, drama, scifi",US,https://www.netflix.com/watch/80242008,https://www.youtube.com/watch?v=tySUZIiXObc,102,6.0,6194.0,8.954,6.0,0
tm832916,The Midnight Sky,"This post-apocalyptic tale follows Augustine, a lonely scientist in the Arctic, as he races to stop Sully and her fellow astronauts from returning home to a mysterious global catastrophe.",MOVIE,2020,"drama, scifi, thriller, fantasy",US,https://www.netflix.com/watch/80244645,https://www.youtube.com/watch?v=DXUUqr3AFKs,118,5.6,81513.0,22.231,5.8,0
tm239927,Official Secrets,The true story of British intelligence whistleblower Katharine Gun who—prior to the 2003 Iraq invasion—leaked a top-secret NSA memo exposing a joint US-UK illegal spying operation against members of the UN Security Council. The memo proposed blackmailing member states into voting for war.,MOVIE,2019,"thriller, crime, drama, war, romance","GB, US",https://www.netflix.com/watch/81052553,https://www.youtube.com/watch?v=t64H3S7r4wo,112,7.3,45200.0,13.217,7.249,0
tm428856,I Am Mother,"A teenage girl is raised underground by a robot ""Mother"", designed to repopulate the earth following an extinction event. But their unique bond is threatened when an inexplicable stranger arrives with alarming news.",MOVIE,2019,"scifi, thriller, horror, drama",AU,https://www.netflix.com/watch/80227090,https://www.youtube.com/watch?v=N5BKctcZxrM,113,6.7,87891.0,20.904,6.696,0
ts219101,Marianne,"When a novelist realizes her terrifying stories are coming true, she returns to her hometown to face the demons from her past that inspire her writing.",SHOW,2019,"thriller, drama, horror",FR,https://www.netflix.com/watch/80217779,https://www.youtube.com/watch?v=q99hib0zS2M,49,7.4,14518.0,22.746,7.7,1
ts221200,The Haunting of Bly Manor,"After an au pair’s tragic death, Henry Wingrave hires a young American nanny to care for his orphaned niece and nephew who reside at Bly Manor with the estate’s chef Owen, groundskeeper Jamie and housekeeper, Mrs. Grose. But all is not as it seems at the manor, and centuries of dark secrets of love and loss are waiting to be unearthed in this chilling tale.",SHOW,2020,"drama, scifi, thriller, horror",US,https://www.netflix.com/watch/81237854,https://www.youtube.com/watch?v=tykS7QfTWMQ,55,7.3,96015.0,29.636,7.8,1
tm849003,The Old Guard,Four undying warriors who've secretly protected humanity for centuries become targeted for their mysterious powers just as they discover a new immortal.,MOVIE,2020,"fantasy, action, thriller",US,https://www.netflix.com/watch/81038963,https://www.youtube.com/watch?v=aK-X2d0lJ_s,125,6.6,155135.0,20.588,7.2,0
ts88577,Hollywood,A group of aspiring actors and filmmakers in post-World War II Hollywood try to make it big — no matter the cost.,SHOW,2020,"drama, history",US,https://www.netflix.com/watch/81088617,https://www.youtube.com/watch?v=Q3EASLgzOcM,50,7.5,35067.0,11.855,7.6,1
tm916405,The Outpost,"A small unit of U.S. soldiers, alone at the remote Combat Outpost Keating, located deep in the valley of three mountains in Afghanistan, battles to defend against an overwhelming force of Taliban fighters in a coordinated attack. The Battle of Kamdesh, as it was known, was the bloodiest American engagement of the Afghan War in 2009 and Bravo Troop 3-61 CAV became one of the most decorated units of the 19-year conflict.",MOVIE,2020,"drama, action, history, war","US, BG",https://www.netflix.com/watch/81276140,https://www.youtube.com/watch?v=f4LM9a02q9Q,123,6.8,31819.0,31.294,6.9,0
ts84661,Cursed,"In this fresh take on the Arthurian legend, teenager Nimue joins forces with mercenary Arthur on a quest to find Merlin and deliver an ancient sword.",SHOW,2020,"scifi, action, drama, fantasy",US,https://www.netflix.com/watch/80199393,https://www.youtube.com/watch?v=xLTdy6PfotA,55,5.8,29446.0,30.279,7.4,1
tm496322,Extraction,"Tyler Rake, a fearless black market mercenary, embarks on the most deadly extraction of his career when he's enlisted to rescue the kidnapped son of an imprisoned international crime lord.",MOVIE,2020,"thriller, crime, drama, action",US,https://www.netflix.com/watch/80230399,https://www.youtube.com/watch?v=L6P3nI6VnlY,116,6.7,192132.0,51.91,7.4,0
tm496322,Extraction,"Tyler Rake, a fearless black market mercenary, embarks on the most deadly extraction of his career when he's enlisted to rescue the kidnapped son of an imprisoned international crime lord.",MOVIE,2020,"thriller, crime, drama, action",US,https://www.netflix.com/watch/80113129,https://www.youtube.com/watch?v=W6nT9cLtX0c,116,6.7,192132.0,51.91,7.4,0
ts105047,To the Lake,A terrible plague strikes and a group decides to risk their lives. Humanity struggles to survive as they face the end of their civilization.,SHOW,2019,"scifi, thriller, drama",RU,https://www.netflix.com/watch/81302258,https://www.youtube.com/watch?v=nWbWf8BvMZM,43,7.2,12456.0,13.757,7.5,1
ts87364,Conversations with a Killer: The Ted Bundy Tapes,"A unique look inside the mind of an infamous serial killer with this cinematic self-portrait crafted from statements made by Ted Bundy, including present-day interviews, archival footage and audio recordings from death row.",SHOW,2019,"crime, history, documentation",US,https://www.netflix.com/watch/80226612,https://www.youtube.com/watch?v=n1UJgrNRcvI,59,7.8,27439.0,14.137,7.6,1
tm444017,"Extremely Wicked, Shockingly Evil and Vile","A chronicle of the crimes of Ted Bundy, from the perspective of his longtime girlfriend, Elizabeth Kloepfer, who refused to believe the truth about him for years.",MOVIE,2019,"crime, drama, thriller",US,https://www.netflix.com/watch/81028570,https://www.youtube.com/watch?v=mdMtnvMJcDA,111,6.7,91162.0,19.891,7.0,0
ts225522,Unorthodox,A Hasidic Jewish woman in Brooklyn flees to Berlin from an arranged marriage and is taken in by a group of musicians -- until her past comes calling.,SHOW,2020,drama,DE,https://www.netflix.com/watch/81019069,https://www.youtube.com/watch?v=-zVhRId0BTw,54,8.0,74118.0,15.173,7.9,1
tm426428,After,"Tessa Young is a dedicated student, dutiful daughter and loyal girlfriend to her high school sweetheart. Entering her first semester of college, Tessa's guarded world opens up when she meets Hardin Scott, a mysterious and brooding rebel who makes her question all she thought she knew about herself -- and what she wants out of life.",MOVIE,2019,"drama, romance",US,https://www.netflix.com/watch/80244311,https://www.youtube.com/watch?v=2ZAdcWHuCmY,106,5.2,52180.0,238.494,7.166,0
tm458585,Dolemite Is My Name,"The story of Rudy Ray Moore, who created the iconic big screen pimp character Dolemite in the 1970s.",MOVIE,2019,"comedy, drama",US,https://www.netflix.com/watch/80182014,https://www.youtube.com/watch?v=Ws1YIKsuTjQ,118,7.2,59836.0,11.036,7.0,0
ts89210,Warrior Nun,"After waking up in a morgue, an orphaned teen discovers she now possesses superpowers as the chosen Halo-Bearer for a secret sect of demon-hunting nuns.",SHOW,2020,"scifi, action, drama, fantasy",US,https://www.netflix.com/watch/80242724,https://www.youtube.com/watch?v=An0bZpuhiBE,43,6.8,29164.0,45.891,7.9,1
ts104401,Ragnarok,A small Norwegian town experiencing warm winters and violent downpours seems to be headed for Ragnarok -- unless someone intervenes in time.,SHOW,2020,"action, drama, fantasy, thriller, scifi",NO,https://www.netflix.com/watch/80232926,https://www.youtube.com/watch?v=7H9AaiBLHCo,47,7.5,36185.0,118.364,8.067,1
ts83657,The Order,"Out to avenge his mother's death, a college student pledges a secret order and lands in a war between werewolves and practitioners of dark magic.",SHOW,2019,"scifi, horror, drama, fantasy, crime, thriller",US,https://www.netflix.com/watch/80238357,https://www.youtube.com/watch?v=iD-cFgDDuqM,48,6.7,27286.0,27.883,7.9,1
tm919961,Pieces of a Woman,"When a young mother's home birth ends in unfathomable tragedy, she begins a year-long odyssey of mourning that fractures relationships with loved ones in this deeply personal story of a woman learning to live alongside her loss.",MOVIE,2020,drama,"HU, US, CA",https://www.netflix.com/watch/81128745,https://www.youtube.com/watch?v=1zLKbMAZNGI,127,7.0,47795.0,10.502,7.098,0
ts222988,Love on the Spectrum,Seven singles take their first steps into the world of dating; this uplifting four-part documentary follows young adults on the autism spectrum as they explore the unpredictable world of love and relationships.,SHOW,2019,"reality, documentation, romance",AU,https://www.netflix.com/watch/81265493,https://www.youtube.com/watch?v=k8PJq8GccJQ,42,8.6,5210.0,5.852,7.9,1
tm1121246,Code 8,"In Lincoln City, some inhabitants have extraordinary abilities. Most live below the poverty line, under the close surveillance of a heavily militarized police force. Connor, a construction worker with powers, involves with a criminal gang to help his ailing mother. (Based on the short film “Code 8,” 2016.)",MOVIE,2019,"scifi, thriller, action, crime, drama","GB, US, CA",https://www.netflix.com/watch/81194641,https://www.youtube.com/watch?v=PrX1JJ5dduA,99,6.1,38850.0,18.193,6.2,0
ts90729,Away,"American astronaut Emma Green must leave her husband and teenage daughter behind to command an international space crew embarking upon a treacherous mission. A series about hope, humanity and how we need one another if we are to achieve impossible things.",SHOW,2020,"scifi, drama, romance",US,https://www.netflix.com/watch/80214512,https://www.youtube.com/watch?v=3f_REapPwio,50,6.6,23706.0,16.426,6.8,1
ts224859,The Pharmacist,"After his son's tragic death, a Louisiana pharmacist goes to extremes to expose the rampant corruption behind the opioid addiction crisis.",SHOW,2020,"crime, documentation",US,https://www.netflix.com/watch/81002576,https://www.youtube.com/watch?v=aiHZ_wU4ktQ,54,7.7,6989.0,3.063,8.4,1
tm417416,Five Feet Apart,"Seventeen-year-old Stella spends most of her time in the hospital as a cystic fibrosis patient. Her life is full of routines, boundaries and self-control — all of which get put to the test when she meets Will, an impossibly charming teen who has the same illness. There's an instant flirtation, though restrictions dictate that they must maintain a safe distance between them. As their connection intensifies, so does the temptation to throw the rules out the window and embrace that attraction.",MOVIE,2019,"romance, drama",US,https://www.netflix.com/watch/80236271,https://www.youtube.com/watch?v=Kwg07npuJhw,116,7.2,61878.0,86.377,8.3,0
tm441231,Murder Mystery,"On a long-awaited trip to Europe, a New York City cop and his hairdresser wife scramble to solve a baffling murder aboard a billionaire's yacht.",MOVIE,2019,"comedy, action, crime, romance",US,https://www.netflix.com/watch/80242619,https://www.youtube.com/watch?v=5YEVQDr2f3Q,97,6.0,120532.0,22.376,6.2,0
tm443615,Rebecca,"After a whirlwind romance with a wealthy widower, a naïve bride moves to his family estate but can't escape the haunting shadow of his late wife.",MOVIE,2020,"thriller, romance, drama",GB,https://www.netflix.com/watch/81002196,https://www.youtube.com/watch?v=t3YJcW2UQiw,121,6.0,40447.0,11.042,6.3,0
ts84663,The Politician,Payton has known since childhood that he's going to be president. First he'll have to navigate the most treacherous political landscape: high school.,SHOW,2019,"comedy, drama",US,https://www.netflix.com/watch/80241248,https://www.youtube.com/watch?v=-D_LdcHtYgU,43,7.5,21887.0,14.713,7.4,1
ts86165,The Society,"When everyone else mysteriously vanishes from their wealthy town, the teen residents of West Ham must forge their own society to survive.",SHOW,2019,"scifi, thriller, drama",US,https://www.netflix.com/watch/80197989,https://www.youtube.com/watch?v=lSj77j1Dnxg,56,7.0,27693.0,21.138,7.7,1
ts215683,The Untamed,"In a land dominated by the mighty Wen clan, a young man named Wei Wuxian strikes up an unconventional friendship with justice-loving Lan Wangji. When the duo unexpectedly stumbles across evidence implicating the Wen clan’s chief in a plot to bring mayhem to the inhabitants of their land, Wei Wuxian and Lan Wangji decide to intervene. However, the pair’s attempts to foil the Wen clan boss’s wicked plans go wrong. In the confusion that follows, Wei Wuxian disappears – with many fearing the worst for him. Sixteen years later, Wei Wuxian returns out of the blue. He is soon reunited with Lan Wangji, just as a spate of mysterious murders has broken out. The duo joins forces once more to investigate, determined not to fail this time… Can the pair get to the bottom of the intrigue? Will they solve the murder cases? And just who is the dastardly secret figure pulling the strings behind the evildoings now blighting the land?",SHOW,2019,"action, comedy, romance, drama, fantasy, horror",CN,https://www.netflix.com/watch/81200228,https://www.youtube.com/watch?v=3mVGYSzg-Pk,44,8.8,5963.0,30.895,8.5,1
tm447963,Fractured,"Driving cross-country, Ray and his wife and daughter stop at a highway rest area where his daughter falls and breaks her arm. After a frantic rush to the hospital and a clash with the check-in nurse, Ray is finally able to get her to a doctor. While the wife and daughter go downstairs for an MRI, Ray, exhausted, passes out in a chair in the lobby. Upon waking up, they have no record or knowledge of Ray's family ever being checked in.",MOVIE,2019,thriller,US,https://www.netflix.com/watch/80223997,https://www.youtube.com/watch?v=sCimThZW-Ew,99,6.4,70860.0,35.497,6.7,0
tm843444,Da 5 Bloods,Four African-American Vietnam veterans return to Vietnam. They are in search of the remains of their fallen squad leader and the promise of buried treasure. These heroes battle forces of humanity and nature while confronted by the lasting ravages of the immorality of the Vietnam War.,MOVIE,2020,"war, drama",US,https://www.netflix.com/watch/81045635,https://www.youtube.com/watch?v=D5RDTPfsLAI,156,6.5,50236.0,16.232,6.6,0
ts85398,Our Planet,Experience our planet's natural beauty and examine how climate change impacts all living creatures in this ambitious documentary of spectacular scope.,SHOW,2019,documentation,GB,https://www.netflix.com/watch/80049832,https://www.youtube.com/watch?v=aETNYyrqNYE,50,9.3,41386.0,19.942,8.8,1
ts218802,The Family,"An enigmatic conservative Christian group known as the Family wields enormous influence in Washington, D.C., in pursuit of its global ambitions.",SHOW,2019,"documentation, sport, reality",US,https://www.netflix.com/watch/80063867,https://www.youtube.com/watch?v=XatRGut65VI,26,6.4,3491.0,6.904,6.9,1
ts218802,The Family,"An enigmatic conservative Christian group known as the Family wields enormous influence in Washington, D.C., in pursuit of its global ambitions.",SHOW,2019,"documentation, sport, reality",US,https://www.netflix.com/watch/70275283,https://www.youtube.com/watch?v=-SwDU04Oeak,26,6.4,3491.0,6.904,6.9,1
ts129445,The Spy,Based on the life of Israeli spy Eli Cohen.,SHOW,2019,"drama, history",FR,https://www.netflix.com/watch/80231337,https://www.youtube.com/watch?v=mYVb4OLk4NQ,53,7.9,40535.0,16.993,7.6,1
ts84993,Daybreak,"Living his best life in post-apocalyptic LA, a slacker strives to find the girl of his dreams while outwitting mindless ghouls and cliquish gangs.",SHOW,2019,"scifi, drama, fantasy, horror, thriller, comedy, action",US,https://www.netflix.com/watch/80197462,https://www.youtube.com/watch?v=hMxE-6RAJm0,44,6.7,19398.0,18.304,7.3,1
tm420826,The Highwaymen,"In 1934, Frank Hamer and Manny Gault, two former Texas Rangers, are commissioned to put an end to the wave of vicious crimes perpetrated by Bonnie Parker and Clyde Barrow, a notorious duo of infamous robbers and cold-blooded killers who nevertheless are worshiped by the public.",MOVIE,2019,"thriller, crime, drama",US,https://www.netflix.com/watch/80200571,https://www.youtube.com/watch?v=aH6vC-BBKOc,132,6.9,88714.0,14.256,6.7,0
tm927480,Kiss the Ground,"Sheds light on an alternative approach to farming called “regenerative agriculture” that could balance our climate, replenish our vast water supplies, and feed the world.",MOVIE,2020,documentation,US,https://www.netflix.com/watch/81321999,https://www.youtube.com/watch?v=K3-V1j-zMZw,84,8.2,6607.0,6.272,8.1,0
