id,title,description,type,release_year,genres,production_countries,Netflix Link,TMDb Trailer,runtime,imdb_score,imdb_votes,tmdb_popularity,tmdb_score,type_netflix
ts20791,Z Nation,"Three years after the zombie virus has gutted the country, a team of everyday heroes must transport the only known survivor of the plague from New York to California, where the last functioning viral lab waits for his blood.",SHOW,2014,"action, drama, scifi, comedy, horror, romance",US,https://www.netflix.com/watch/80008434,https://www.youtube.com/watch?v=aRnGA9iZdRA,43,6.6,36059.0,66.412,7.2,1
ts2727,Derek,Derek is a loyal nursing home caretaker who sees only the good in his quirky co-workers as they struggle against prejudice and shrinking budgets to care for their elderly residents.,SHOW,2013,"drama, comedy, european",GB,https://www.netflix.com/watch/70258489,https://www.youtube.com/watch?v=Hd5WdxGRNG8,26,8.1,31976.0,9.295,7.4,1
tm237143,Shrek the Musical,Shrek The Musical is a musical with music by Jeanine Tesori and book and lyrics by David Lindsay-Abaire. It is based on the 2001 DreamWorks Animation's film Shrek and William Steig's 1990 book Shrek! It was nominated for 8 Tony Awards including Best Musical.,MOVIE,2013,"fantasy, family, comedy",US,https://www.netflix.com/watch/70253398,https://www.youtube.com/watch?v=UPSPj3kx3Cc,130,6.9,3634.0,14.341,7.2,0
ts20097,Hemlock Grove,"One cannot quench his all-consuming thirst. The other cannot tame the beast clawing its way out. In the sleepy Pennsylvania village of Hemlock Grove, two young men struggle to accept painful truths: about family, themselves, the mystery of the White Tower - and a terrifying new threat so powerful it will turn them from predators into prey.",SHOW,2013,"thriller, drama, fantasy, horror, scifi",US,https://www.netflix.com/watch/70242310,https://www.youtube.com/watch?v=rlZUsPcChgI,49,7.0,39590.0,22.596,7.3,1
tm178712,Scary Movie 5,"Home with their newly-formed family, happy parents Dan and Jody are haunted by sinister, paranormal activities. Determined to expel the insidious force, they install security cameras and discover their family is being stalked by an evil dead demon.",MOVIE,2013,"comedy, horror",US,https://www.netflix.com/watch/70253160,https://www.youtube.com/watch?v=RMDZ8M47j0I,86,3.5,70814.0,122.985,4.8,0
ts20281,Sofia the First,"Set in the storybook world of Enchancia, this is the story of Princess Sofia, an adventurous little girl who is learning how to adjust to royal life after her mom marries the king and she becomes a princess overnight.",SHOW,2013,"family, fantasy, animation",US,https://www.netflix.com/watch/70293622,https://www.youtube.com/watch?v=6DmW3BBAz_Y,24,6.8,2915.0,44.688,7.2,1
ts20014,Sailor Moon Crystal,Usagi Tsukino is chosen to be a guardian of justice and is sent on a quest to locate a Silver Crystal before the Dark Kingdom invades the Earth.,SHOW,2014,"scifi, animation, action, comedy, drama, fantasy, romance, family",JP,https://www.netflix.com/watch/80145747,https://www.youtube.com/watch?v=eUiewJt80eQ,24,7.8,2115.0,47.398,8.2,1
tm187979,Cloudy with a Chance of Meatballs 2,"After the disastrous food storm in the first film, Flint and his friends are forced to leave the town. Flint accepts the invitation from his idol Chester V to join The Live Corp Company, which has been tasked to clean the island, and where the best inventors in the world create technologies for the betterment of mankind. When Flint discovers that his machine still operates and now creates mutant food beasts like living pickles, hungry tacodiles, shrimpanzees and apple pie-thons, he and his friends must return to save the world.",MOVIE,2013,"comedy, family, fantasy, scifi, drama, animation",US,https://www.netflix.com/watch/70273612,https://www.youtube.com/watch?v=3QCJTbHU60U,95,6.3,100637.0,64.17,6.443,0
ts35570,Lovesick,"After finding out he has an STI, Dylan must get back in touch with every girl he has ever had sex with to let them know the bad news.",SHOW,2014,"comedy, european",GB,https://www.netflix.com/watch/80184358,https://www.youtube.com/watch?v=fjIB1E8nH7w,24,8.1,19259.0,12.802,7.5,1
ts32271,Shtisel,"Akiva and Shulem Shtisel, father and son, sit on a little balcony overlooking streets of the Geula neighborhood of Jerusalem. A year has passed since the mother died. All the other children have left the nest, and only Shulam and Akiva remain - quarreling, making up, and laughing about themselves and the rest of the world. All will change when Akiva meets Elisheva.",SHOW,2013,drama,IL,https://www.netflix.com/watch/81004164,https://www.youtube.com/watch?v=Nxm5ZNCcIsQ,48,8.6,6958.0,14.873,8.4,1
tm140342,"I, Frankenstein","200 years after his shocking creation, Dr. Frankenstein's creature, Adam, still walks the earth. But when he finds himself in the middle of a war over the fate of humanity, Adam discovers he holds the key that could destroy humankind.",MOVIE,2014,"horror, thriller, scifi, action, fantasy","AU, US",https://www.netflix.com/watch/70242805,https://www.youtube.com/watch?v=NXc5epxOH_c,92,5.1,80733.0,22.094,5.3,0
tm141648,Seventh Son,"John Gregory, who is a seventh son of a seventh son and also the local spook, has protected the country from witches, boggarts, ghouls and all manner of things that go bump in the night. However John is not young anymore, and has been seeking an apprentice to carry on his trade. Most have failed to survive. The last hope is a young farmer's son named Thomas Ward. Will he survive the training to become the spook that so many others couldn't?",MOVIE,2014,"fantasy, action","US, GB, CN, CA",https://www.netflix.com/watch/70275284,https://www.youtube.com/watch?v=5i90Qr0Qi6w,120,5.5,76395.0,45.215,5.5,0
ts22426,The Irregular at Magic High School,In a world where magic is not a fairy tale but has existed for one hundred years siblings Tatsuya and Miyuki Shiba prepare to begin their studies at the elite Private Magic University Affiliated High School (Magic High School for short). Entering on different levels of the academic spectrum the two turn the once peaceful campus into a chaotic one.,SHOW,2014,"scifi, romance, animation, action, drama, fantasy",JP,https://www.netflix.com/watch/80009361,https://www.youtube.com/watch?v=U-gkwdGooDU,24,7.1,3273.0,46.794,7.9,1
tm181081,The Railway Man,"A victim from World War II's ""Death Railway"" sets out to find those responsible for his torture. A true story.",MOVIE,2013,"drama, european, war, romance","GB, AU, CH",https://www.netflix.com/watch/70293617,https://www.youtube.com/watch?v=ksrkKXoEJbM,116,7.1,39743.0,8.518,6.9,0
tm154797,The Nut Job,"Surly, a curmudgeon, independent squirrel is banished from his park and forced to survive in the city. Lucky for him, he stumbles on the one thing that may be able to save his life, and the rest of park community, as they gear up for winter - Maury's Nut Store.",MOVIE,2014,"comedy, crime, family, animation","CA, KR",https://www.netflix.com/watch/70286697,https://www.youtube.com/watch?v=fq4qP2oSpIA,85,5.7,28295.0,20.859,5.7,0
ts35244,Tiny House Nation,Tiny House Nation takes renovation experts John Weisbarth and Zack Griffinh across America to help design and construct tiny dream homes in spaces under 500 square feet. Tiny House Nation proves size doesn't matter it's creative that counts!,SHOW,2014,reality,US,https://www.netflix.com/watch/81016914,https://www.youtube.com/watch?v=wtRzGNswWU8,43,7.1,1126.0,4.211,7.5,1
tm148976,The Battered Bastards of Baseball,Hollywood veteran Bing Russell creates the only independent baseball team in the country—alarming the baseball establishment and sparking the meteoric rise of the 1970s Portland Mavericks.,MOVIE,2014,"documentation, sport",US,https://www.netflix.com/watch/70299904,https://www.youtube.com/watch?v=RA76b5Hhvxg,80,8.0,3953.0,6.367,7.6,0
ts10206,Ever After High,"The students of all the fairytale characters attend Ever After High, where they are either Royals (students who want to follow in their parent's footsteps) or Rebels (students who wish to write their own destiny).",SHOW,2013,"action, comedy, drama, family, fantasy, music, romance, animation",CA,https://www.netflix.com/watch/70300626,https://www.youtube.com/watch?v=CKOh9EjyZH4,30,7.7,1130.0,28.659,7.8,1
ts20709,Yowamushi Pedal,"Sakamichi Onada is a wimpy high school freshman who loves anime. He initially wants to enter the anime club, but winds up joining the cycling club after meeting two classmates who are already famous cyclists. He undertakes the grueling training to compete in races, and discovers his own hidden talent in cycling.",SHOW,2013,"comedy, drama, sport, animation",JP,https://www.netflix.com/watch/80172137,https://www.youtube.com/watch?v=qgRvevEHoL4,24,7.7,808.0,23.065,7.3,1
ts20709,Yowamushi Pedal,"Sakamichi Onada is a wimpy high school freshman who loves anime. He initially wants to enter the anime club, but winds up joining the cycling club after meeting two classmates who are already famous cyclists. He undertakes the grueling training to compete in races, and discovers his own hidden talent in cycling.",SHOW,2013,"comedy, drama, sport, animation",JP,https://www.netflix.com/watch/80061943,https://www.youtube.com/watch?v=qgRvevEHoL4,24,7.7,808.0,23.065,7.3,1
tm166628,The Smurfs 2,"The evil wizard Gargamel creates a couple of mischievous Smurf-like creatures called the Naughties that he hopes will let him harness the all-powerful, magical Smurf-essence. But when he discovers that only a real Smurf can give him what he wants, and only a secret spell that Smurfette knows can turn the Naughties into real Smurfs, Gargamel kidnaps Smurfette and brings her to Paris, where he has been winning the adoration of millions as the world¹s greatest sorcerer. It's up to Papa, Clumsy, Grouchy, and Vanity to return to our world, reunite with their human friends Patrick and Grace Winslow, and rescue her! Will Smurfette, who has always felt different from the other Smurfs, find a new connection with the Naughties Vexy and Hackus or will the Smurfs convince her that their love for her is True Blue?",MOVIE,2013,"fantasy, animation, comedy, family",US,https://www.netflix.com/watch/70269568,https://www.youtube.com/watch?v=W-yEIIMtwCA,105,5.3,41571.0,32.819,5.8,0
tm136601,Walk of Shame,"A reporter's dream of becoming a news anchor is compromised after a one-night stand leaves her stranded in downtown L.A. without a phone, car, ID or money - and only 8 hours to make it to the most important job interview of her life.",MOVIE,2014,comedy,US,https://www.netflix.com/watch/70266682,https://www.youtube.com/watch?v=yaRw4auU2kQ,95,6.0,54065.0,23.897,5.9,0
tm71148,Thanks for Sharing,A romantic comedy that brings together three disparate characters who are learning to face a challenging and often confusing world as they struggle together against a common demon—sex addiction.,MOVIE,2013,"drama, comedy, romance",US,https://www.netflix.com/watch/70259082,https://www.youtube.com/watch?v=FP0aIPWCuDo,112,6.4,28204.0,9.986,5.9,0
tm185208,Elena,"Petra heads to New York in search of her older sister after a long time of being separated. They are both movie actresses and heirs of the wounds of the Brazilian dictatorship. But Petra has only a few clues: home movies, newspaper clippings, a diary...",MOVIE,2013,"documentation, european, drama, family","US, BR",https://www.netflix.com/watch/81137484,https://www.youtube.com/watch?v=Hpg10V0v-7E,82,7.6,1823.0,4.427,7.4,0
tm167944,Berserk: The Golden Age Arc III - The Advent,"A year has passed since Guts parted ways with the Band of the Hawks. Meanwhile, his former mercenary group is plotting a rescue mission to save an imprisoned Griffith.",MOVIE,2013,"fantasy, action, drama, horror, romance, animation",JP,https://www.netflix.com/watch/80063025,https://www.youtube.com/watch?v=O8dq05dM-Yk,110,7.8,9942.0,41.099,7.6,0
ts21368,Black Money Love,"Ömer is a police officer. After the death of his fiancée, he suffers great pain. The body of Sibel, Ömer's fiancée, was found on the top of a cliff, in a car next to a fairly old, rich business man. After the shock of her sudden death and the accusations of his love cheating on him, Ömer realizes that there is more behind her suspicious murder",SHOW,2014,"action, drama, romance, crime",TR,https://www.netflix.com/watch/80176234,https://www.youtube.com/watch?v=rf4GgSBEaCI,90,7.4,5975.0,24.363,8.2,1
tm174289,Free Birds,Two turkeys from opposite sides of the tracks must put aside their differences and team up to travel back in time to change the course of history—and get turkey off the holiday menu for good.,MOVIE,2013,"comedy, family, scifi, animation",US,https://www.netflix.com/watch/70270273,https://www.youtube.com/watch?v=x9RvyOjnyxk,91,5.8,23917.0,17.211,5.9,0
tm187390,The Square,"The Square looks at the hard realities faced day-to-day by people working to build Egypt’s new democracy. Cairo’s Tahrir Square is the heart and soul of the film, which follows several young activists. Armed with values, determination, music, humor, an abundance of social media, and sheer obstinacy, they know that the thorny path to democracy only began with Hosni Mubarek’s fall. The life-and-death struggle between the people and the power of the state is still playing out.",MOVIE,2013,"drama, history, documentation","GB, US, EG",https://www.netflix.com/watch/70268449,https://www.youtube.com/watch?v=twB2zAOzsKE,88,8.1,8949.0,5.434,7.8,0
tm171929,The Short Game,"Each year, the world’s best 7 year-old golfers descend on Pinehurst, North Carolina to compete in the World Championships of Junior Golf. The Short Game follows eight of these very young athletes on their quest to become the sport’s next phenom.",MOVIE,2013,"documentation, sport",US,https://www.netflix.com/watch/70290567,https://www.youtube.com/watch?v=-iKW3vldhw0,100,7.3,1518.0,3.553,7.3,0
ts34066,Mako Mermaids: An H2O Adventure,"Real-life mermaids, Sirena, Nixie and Lyla are part of a mermaid pod, which lives in the waters of Mako Island. As young members of the pod, it is their job to protect the Moon Pool and guard it from trespassers. But on the night of a full moon, the mischievous mermaid girls neglect their duties. Sixteen-year-old land-dweller Zac enters the Moon Pool and forms a special connection with Mako.

Zac is given a fish-like tail and amazing powers. The mermaid pod is forced to leave Mako, leaving behind the three mermaid girls, cast out of the pod. They know there's only one way they will be allowed to rejoin the pod: They must get legs, venture onto land and take back Zac's powers – or risk being outcasts forever.",SHOW,2013,"scifi, action, comedy, drama, family, fantasy, romance",AU,https://www.netflix.com/watch/70281343,https://www.youtube.com/watch?v=1_VMGxE4Qb0,25,6.7,3924.0,41.013,7.6,1
tm138431,Virunga,"Virunga in the Democratic Republic of the Congo is Africa’s oldest national park, a UNESCO world heritage site, and a contested ground among insurgencies seeking to topple the government that see untold profits in the land. Among this ongoing power struggle, Virunga also happens to be the last natural habitat for the critically endangered mountain gorilla. The only thing standing in the way of the forces closing in around the gorillas: a handful of passionate park rangers and journalists fighting to secure the park’s borders and expose the corruption of its enemies. Filled with shocking footage, and anchored by the surprisingly deep and gentle characters of the gorillas themselves, Virunga is a galvanizing call to action around an ongoing political and environmental crisis in the Congo.",MOVIE,2014,"war, documentation","CD, GB",https://www.netflix.com/watch/80009431,https://vimeo.com/92226142,90,8.2,11403.0,5.962,8.0,0
tm152904,Tom Segura: Completely Normal,An original stand-up comedy special written and performed by comedian Tom Segura.,MOVIE,2014,"comedy, documentation",US,https://www.netflix.com/watch/70301023,https://www.youtube.com/watch?v=uDr1W-Dm4do,74,7.7,2570.0,3.08,7.2,0
tm35895,Buddies,"A road movie that shows the simple things in life in a poetic light through the eyes of three young people with Down syndrome, who love movies and work at the video library of the institution where they have always lived in. One day, inspired by the movie ""Thelma & Louise"", they decide to run away using the gardener's old car to have a freedom experience. They travel to uncommon places in search for three simple wishes: Stalone wants to see the sea, Aninha looks for a husband and Marcio needs to fly. During this search, they embark on several adventures as if life was just a children's play",MOVIE,2013,"drama, comedy, documentation, european",BR,https://www.netflix.com/watch/80095232,https://www.youtube.com/watch?v=iAf9B6Fuzwk,94,6.6,1076.0,3.198,6.9,0
ts37187,Senora Acero,"The adventures of Vicenta Acero, the feared coyote who now leads the dynasty of illicit dealings once under the control of her father.",SHOW,2014,"crime, drama, romance",US,https://www.netflix.com/watch/80046347,https://www.youtube.com/watch?v=Kcg91jlXyzo,43,6.8,375.0,139.363,7.8,1
tm199408,Monty Python: The Meaning of Live,"With unprecedented access, this program reveals the humour, chaos and passion that went into bringing the Flying Circus to the stage cumulating in the legendary One Down, Five To Go.",MOVIE,2014,"comedy, documentation",GB,https://www.netflix.com/watch/80236470,https://www.youtube.com/watch?v=z7bNziRXDuE,96,7.6,574.0,1.714,7.4,0
ts33840,Nagi-Asu: A Lull in the Sea,"Long ago, all humans lived beneath the sea. However, some people preferred the surface and abandoned living underwater permanently. As a consequence, they were stripped of their god-given protection called ""Ena"" which allowed them to breathe underwater. Over time, the rift between the denizens of the sea and of the surface widened, although contact between the two peoples still existed.

This show follows the story of Hikari Sakishima and Manaka Mukaido, along with their childhood friends Chisaki Hiradaira and Kaname Isaki, who are forced to leave the sea and attend a school on the surface. There, the group also meets Tsumugu Kihara, a fellow student and fisherman who loves the sea.

Hikari and his friends' lives are bound to change as they have to deal with the deep-seated hatred and discrimination between the people of sea and of the surface, the storms in their personal lives, as well as an impending tempest which may spell doom for all who dwell on the surface.",SHOW,2013,"scifi, animation, drama, fantasy, romance",JP,https://www.netflix.com/watch/80132218,https://www.youtube.com/watch?v=rukiDx9hYDM,23,7.3,1152.0,12.324,7.5,1
tm168685,The Berlin File,"When an illicit arms deal goes bad, North Korean spy Pyo Jong-seong finds himself targeted not just by the South Koreans but also his own bosses.",MOVIE,2013,"thriller, action",KR,https://www.netflix.com/watch/70270715,https://www.youtube.com/watch?v=7BtN4SKFjOU,120,6.6,7103.0,7.911,6.7,0
tm148910,Haider,A young man returns to Kashmir after his father's disappearance to confront his uncle - the man he suspects to have a role in his father's fate.,MOVIE,2014,"drama, action, crime, thriller",IN,https://www.netflix.com/watch/70303432,https://www.youtube.com/watch?v=ZmN_VSo8DOo,150,8.1,54001.0,7.372,7.1,0
ts83239,Booba,"The world is a mystery to little Booba. But he approaches the curiosities around him with wonder, finding adventure in his everyday surroundings.",SHOW,2014,"comedy, family, animation",RU,https://www.netflix.com/watch/81011059,https://www.youtube.com/watch?v=ah-e7eLseys,4,7.0,390.0,10.547,7.0,1
ts16117,20 Minutes,An innocent pastrycook Melek gets accused of injuring an important politician's son. Her loving husband Ali wants to help his wife to escape from prison.,SHOW,2013,"action, drama, romance",TR,https://www.netflix.com/watch/80175913,https://www.youtube.com/watch?v=GbebKg5kbqI,45,7.3,1681.0,2.294,8.0,1
tm165504,Blind Detective,"A blind detective, former cop, teams up with a policewoman who admires him to solve the disappearance of a girl friend of hers, years ago. Besides, he helps her to improve her skills as an investigator.",MOVIE,2013,"crime, drama, thriller, action, comedy","CN, HK",https://www.netflix.com/watch/70285697,https://www.youtube.com/watch?v=6HUMQfvwYvE,130,6.4,3255.0,7.454,6.0,0
tm158980,Khoobsurat,"A vibrant, hopelessly romantic physiotherapist meets a handsome young Rajput prince who is the complete opposite of her – and is engaged to someone else.",MOVIE,2014,"comedy, romance",IN,https://www.netflix.com/watch/70303428,https://www.youtube.com/watch?v=pOreDBy1YfI,130,6.5,8330.0,6.343,6.765,0
tm145791,Miss Granny,An unappreciated old granny magically turns 20 years old again and decides to make the most of her newfound youth.,MOVIE,2014,"drama, comedy, fantasy, music",KR,https://www.netflix.com/watch/70299544,https://www.youtube.com/watch?v=Zn8vbPY_o5s,124,7.2,3433.0,6.475,7.4,0
tm156811,Queen,"Rani, a 24-year-old homely girl, decides to go on her honeymoon alone when her fiancé calls off the wedding. Traveling around Europe, she finds joy, makes friends, and gains new-found independence.",MOVIE,2014,"drama, comedy",IN,https://www.netflix.com/watch/80032081,https://www.youtube.com/watch?v=Kj9jAHUIH_8,146,8.2,64805.0,8.434,7.4,0
ts3799,All Hail King Julien,"King Julien is back and shaking his booty harder than ever! Discover the wild world of Madagascar as the king takes on the jungle’s craziest adventures in this comedy series. With his loyal sidekicks Maurice and Mort, they meet a whole new cast of colorful animals, including ambitious head of security Clover and the villainous Foosa. No one can stop this king from ruling with an iron fist...in the air...wavin' like he just doesn't care.",SHOW,2014,"action, comedy, family, fantasy, animation",US,https://www.netflix.com/watch/80018987,https://www.youtube.com/watch?v=Nspwf-5-oso,23,7.0,2008.0,26.409,6.9,1
tm151210,Jim Gaffigan: Obsessed,"Jim Gaffigan bursts back on the scene with this eagerly anticipated fourth comedy special. Dubbed the ""King of Clean Comedy"" by The Wall Street Journal, Jim's obsession with all things food comes to fruition on Obsessed as he tackles a cornucopia of new food topics from fruit to seafood to donuts. Get ready for 70 minutes of non-stop laughs at Jim's twisted-yet-enlightened observations on the seemingly mundane topics that have made him a fixture in the comedy world for audiences of all ages.",MOVIE,2014,"comedy, documentation",US,https://www.netflix.com/watch/70301469,https://www.youtube.com/watch?v=xD8X66rWiR0,70,7.6,2226.0,3.499,7.2,0
tm149578,Mission Blue,"Feature documentary about legendary oceanographer, marine biologist, environmentalist and National Geographic Explorer-in-Residence Sylvia Earle, and her campaign to create a global network of protected marine sanctuaries",MOVIE,2014,"documentation, drama",US,https://www.netflix.com/watch/70308278,https://www.youtube.com/watch?v=B1wp2MQCsfQ,94,7.9,1950.0,4.029,7.5,0
tm178513,Bombay Talkies,One hundred years of Hindi cinema is celebrated in four short stories showcasing the power of film.,MOVIE,2013,drama,IN,https://www.netflix.com/watch/70275753,https://www.youtube.com/watch?v=njzTBH8mZLU,127,6.6,5372.0,4.389,6.5,0
tm182322,Kai Po Che!,Three friends growing up in India at the turn of the millennium set out to open a training academy to produce the country's next cricket stars.,MOVIE,2013,"drama, sport",IN,https://www.netflix.com/watch/70254346,https://www.youtube.com/watch?v=a1s3YIagZOo,126,7.8,36512.0,6.691,7.0,0
tm236725,My Beautiful Broken Brain,"A profoundly personal voyage into the complexity, fragility and wonder of the human brain, after Lotje Sodderland miraculously survives a hemorrhagic stroke and finds herself starting again in an alien world, bereft of language and logic. This feature documentary takes us on a genre-twisting tale that is by turns excruciating and exquisite - from the devastating consequences of a first-time neurological experiment, through to the extraordinary revelations of her altered sensory perception.",MOVIE,2014,documentation,GB,https://www.netflix.com/watch/80049951,https://www.youtube.com/watch?v=VSfpA3AEKmY,84,7.1,2257.0,3.201,7.1,0
tm153055,Mitt,A filmmaker is granted unprecedented access to a political candidate and his family as he runs for President.,MOVIE,2014,"documentation, family",US,https://www.netflix.com/watch/70296733,https://www.youtube.com/watch?v=rLHxbemvpxY,93,6.9,2579.0,3.843,6.3,0
tm185797,Fukrey,"The paths of four dream-chasing college friends cross with an array of colourful characters, from a tough-talking Punjabi female don to a Jugaad Baaz college watchman. Mayhem ensues.",MOVIE,2013,"romance, comedy, drama",IN,https://www.netflix.com/watch/70278990,https://www.youtube.com/watch?v=V9qgeeO7tMk,137,6.9,11656.0,4.383,6.8,0
tm154729,Dedh Ishqiya,A team of con men fall for a Begum and her female confidante. Does their love fructify?,MOVIE,2014,"drama, romance, thriller, comedy",IN,https://www.netflix.com/watch/80049210,https://www.youtube.com/watch?v=_J3fkfUDkx8,152,7.0,7179.0,2.411,6.5,0
tm148457,Hasee Toh Phasee,"On the eve of Nikhil and Karishma’s engagement, Karishma’s wealthy father, Devesh Solanki, expresses his disapproval, believing Nikhil to be a lackadaisical young man. With one week to prove himself worthy to marry Karishma, Nikhil and Karishma's sister, Meeta, grow closer to each other.",MOVIE,2014,"comedy, romance",IN,https://www.netflix.com/watch/70302193,https://www.youtube.com/watch?v=Xv5MG0LhaP4,141,6.8,14916.0,6.166,6.7,0
tm158302,Ankhon Dekhi,"Bauji resists his daughter's request to let her marry the man she loves as the villagers incessantly shame him. However, his opinion changes after he meets him and he decides to change his viewpoint.",MOVIE,2014,"drama, comedy",IN,https://www.netflix.com/watch/70307997,https://www.youtube.com/watch?v=H3yKUHI2mE4,104,8.0,11330.0,4.013,6.9,0
